{
  "$schema": "https://json-schema.org/draft/2020-12/schema",
  "title": "LegoLens Review Log Entry",
  "type": "object",
  "required": [
    "review_id",
    "entity_type",
    "entity_id",
    "action",
    "reviewer",
    "created_at"
  ],
  "properties": {
    "review_id": {
      "type": "string"
    },
    "entity_type": {
      "type": "string"
    },
    "entity_id": {
      "type": "string"
    },
    "action": {
      "type": "string"
    },
    "reviewer": {
      "type": "string"
    },
    "reason": {
      "type": "string"
    },
    "created_at": {
      "type": "string"
    }
  }
}
